{
  "archCount": 4,
  "archRise": 10,
  "archShape": "segmental",
  "brick": {
    "allowed": [
      "brick-2x4",
      "brick-2x2",
      "brick-1x4",
      "brick-1x2",
      "brick-1x1",
      "arch-wedge"
    ],
    "bondPattern": "running",
    "deckThicknessLayers": 3,
    "layerHeight": 1,
    "maxBeamStuds": 24,
    "sideThicknessStuds": 2,
    "studSize": 1
  },
  "bridgeWidth": 13,
  "deckHeight": 34,
  "family": "viaduct",
  "seed": 17,
  "span": 96,
  "structuralDensity": 0.68,
  "symmetry": true,
  "targetLoadClass": 3,
  "vehicleClearance": 7,
  "version": 3
}
